city	raw text	clean text	clusterid
AL Birmingham	"aBirmingham
Rising
Birmingham Rising! Meeting the Challenge to Become America’s Next Smart City 
 iContents
Introduction  ......................................................................................................1
Our City  ............................................................................................................1Our Challenge ...................................................................................................3Our Opportunities ..............................................................................................3
Our Vision ..........................................................................................................3Our Goal ..........................................................................................................10Our Approach ..................................................................................................12
Our Capacity ...................................................................................................18Our Commitment .............................................................................................20
Our Process ....................................................................................................21Our Risks .........................................................................................................22Our Systems ....................................................................................................23Our Data ..........................................................................................................24Our Influence ...................................................................................................25Letters of Support............................................................................................27 Become America’s Next Smart City
1Introduction 
William T. Coleman, Jr., the fourth Secretary of 
TransportaƟ  on, painted a picture of the ways 
in which our society would travel and interact. Under his leadership, the U.S. Department of TransportaƟ  on set about creaƟ  ng a planning 
and decision-making framework to guide that future.  Secretary Coleman’s future became reality…for most of the country.  For others, Ɵ me seemed to stand sƟ  ll and liƩ  le progress 
was made. Such is the case for the City of Birmingham.
Fast forward to today.  Under the leadership 
of Secretary of TransportaƟ  on Anthony Foxx, 
the U.S. Department of TransportaƟ  on has 
developed a 30-year transportaƟ  on plan for 
the naƟ  on.  The plan, enƟ  tled Beyond Traﬃ   c, 
has a very clear thesis: the United States needs to pivot away from its reliance on the car towards mobility systems that are beƩ  er 
suited to ciƟ  es.  We couldn’t agree more!
The City of Birmingham will be one of the 
U.S. ciƟ  es that helps the naƟ  on achieve its 
transportaƟ  on vision.  The City is reemerging 
as a vibrant southern city, a place where people choose to live, businesses can innovate, grow, and thrive, and visitors seek out for historic, cultural, and recreaƟ  onal 
experiences. Through careful comprehensive community planning, good leadership, collaboraƟ  on and targeted investment, 
Birmingham is taking advantage of new opportuniƟ  es, and improving the overall 
quality of life for its residents.  Renewed investment in the City’s transportaƟ  on system 
will breathe new life into the City, especially those areas that are experiencing urban decay.Our City 
Located in a dramaƟ  c physical landscape, 
Birmingham is the county seat of Jeﬀ  erson 
County and is the largest city in Alabama.  It is ﬂ  anked by parallel mountain ridges of 
the southern extension of the Appalachian Mountains, which contain the minerals upon which the city’s early heavy industry was founded. MulƟ  ple railroad corridors that 
thread their way through the Birmingham area were the key to the city’s development as an industrial powerhouse, facilitaƟ  ng the 
transformaƟ  on of the area’s rich mineral 
wealth into one of the naƟ  on’s most important 
sources of iron and steel during the Industrial RevoluƟ  on. 
Economic decline iniƟ  ated by populaƟ  on 
ﬂ ight to the suburbs was exacerbated by the 
concurrent mass exodus of heavy industrial jobs from Birmingham. The iron and steel industry had long been the foundaƟ  on of 
middle income prosperity in Birmingham. However, by the 21st century, this keystone had been eﬀ  ecƟ vely pulled from Birmingham’s 
economic arch. 
As the eﬀ  ects of the Great Recession of 
2008 are waning, Birmingham is gaining vitality and populaƟ  on. This is in part thanks 
to a mammoth eﬀ  ort to reinvent itself as a 
more livable community, aƩ  racƟ  ve for the 
businesses and professionals that will drive our economy in the 21st century. The Smart City concepts presented herein will support this renewal and help expand economic opportunity to Birmingham’s long neglected  minority and low-income neighborhoods.
According to the 2010 U.S. Census’s 
Designated Place data, the City of Birmingham had a populaƟ  on of 212,237.  At that Ɵ  me, 
the City comprised 28.3% of the urbanized area’s total populaƟ  on, and had an average 
populaƟ  on density of 1,453 persons per  Meeting the Challenge to Become to Birmingham Rising
2square mile.  This is well within the populaƟ  on 
and density characterisƟ  cs of a Smart City.
According the U.S. Bureau of the Census’s 
LEHD, the City of Birmingham contains approximately 163,000 jobs, of which just under 130,000 are located in the awarded Birmingham BRT corridor. The Downtown and UAB/Five Points South subareas combined have over 70,000 jobs, which is approximately 43 percent of the City’s total jobs, and 54 percent of the jobs in the BRT corridor.  The BRT corridor plays an important role in our vision to transform Birmingham into a Smart City. The vision will be arƟ  culated more clearly 
later in this response.
Other things to know about the City of 
Birmingham include:
• Birmingham has 99 neighborhoods
• Birmingham is the Southeast’s premier 
medical mecca
• 18,,500 students are enrolled in UAB
• Close to 80 percent of the State of Alabama’s populaƟ  on is within a 100 mile 
radius of the City of Birmingham
• Birmingham is served by ﬁ  ve (5) interstate 
highways: I-20, I-59, I-65, I-22, and I-459
• Birmingham is served by three (3) Tier 1 rail providers
• 60 percent of the 11 state Southeastern market can be reached by truck within one-day’s freight travel Ɵ  me
• 90 percent of the U.S. populaƟ  on can be 
reached by truck within a three-day freight travel Ɵ  me
In terms of how the City of Birmingham relates 
to the State of Alabama and the synergisƟ  c 
role of the two enƟ  Ɵ es, know that  Alabama 
is now the ﬁ  Ō h largest auto producing state, 
and employment in the sector is approaching 40,000. Alabama’s three global automakers, Mercedes-Benz, Honda and Hyundai, combined to produce more than 1 million 
vehicles in 2015, the ﬁ  rst Ɵ  me the state’s 
annual output has reached that big-league milestone.  All three automakers are exploring, and have incorporated autonomous vehicle technology into their vehicles.  This technology includes everything from navigaƟ  on systems, 
to communicaƟ  ons and entertainment 
systems, to automaƟ  c braking, and crash 
avoidance systems.
Automobile and parts manufacturing, and the 
technology that accompanies it has become the state ’s top e xport category , reaching $6.6 
billion in 2014. New auto-related investment in the sector during the past four-years tops $5.5 billion. 
Birmingham city closely aligns with the 
USDOT’s characterisƟ  cs for a Smart City, as it 
provides:
• ExisƟ  ng public transportaƟ  on system 
and plans for new addiƟ  ons to the public 
transportaƟ  on services; 
• Environment that is conducive to 
demonstraƟ  ng proposed strategies;
• Leadership with proven record of 
commitment and dedicaƟ  on, and the 
capacity to carry out the demonstraƟ  on 
throughout the period of performance;
• A solid commitment to integraƟ  ng with 
the sharing economy and share assets in a seamless way; and
• A clear commitment to open data and data sharing, thus making data accessible and usable by the public to maximize beneﬁ  t 
and promote entrepreneurship and innovaƟ  on. Become America’s Next Smart City
3Our Challenge
The City of Birmingham is challenged to 
meet its mobility needs because of its poor transportaƟ  on connecƟ  vity across all modes, 
underuƟ  lizaƟ  on of exisƟ  ng transportaƟ  on 
resources, limited transit, bicycle, and pedestrian opƟ  ons, and aging/crumbling 
and outdated transportaƟ  on infrastructure.  
The transportaƟ  on system has been cited 
as a barrier to opportuniƟ  es and access to 
both health services and healthy foods.  The historic network of roadways is not friendly to pedestrians or cyclists, and the general lack of pedestrian faciliƟ  es and inter-community 
connecƟ  ons are all contributors to a widening 
gap in socio-economic condiƟ  ons.  In addiƟ  on, 
the City of Birmingham also is confronted with a declining total populaƟ  on, an aging ciƟ  zen 
base, and concentraƟ  ons of poverty. Each of 
these issues is exacerbated by the poor quality of the exisƟ  ng transportaƟ  on system.
AddiƟ  onally, the City does not have 
informaƟ  on systems built. The technology and 
data that currently exists are disconnected and isolated, and endures in pockets/silos. The challenge is to integrate it all -- the systems, the technology, the informaƟ  on – and to exploit its 
power to the fullest.
Our Opportunities
The City is transforming rapidly and its change is inevitable.  Birmingham’s downtown is already experiencing a resurgence, and the City as a whole is undergoing a regeneraƟ  on of 
its ninety-nine (99) neighborhoods. The City’s revitalizaƟ  on eﬀ  orts are largely focused on: 
improving quality of life for ciƟ  zens; protecƟ  ng 
and enhancing the unique sense of place; rebuilding the economy with a foundaƟ  on 
of diversity and resiliency; and orientaƟ  on 
toward innovaƟ  on and a healthy workforce. 
Birmingham and its greater region are strategically targeƟ  ng catalyƟ  c transportaƟ  on 
and land use/land development eﬀ  orts in a 
handful of core areas and travel corridors, and are beginning to realize success through these areas successful transformaƟ  on.  For this 
success to conƟ  nue, the City of Birmingham 
needs to make a “big leap”, and modernize its transportaƟ  on infrastructure and service 
delivery. However, modernizaƟ  on does not 
mean looking to the status quo. Instead, the City of Birmingham is looking to become a naƟ onal leader for urban mobility.
In 2015, the U.S. Department of TransportaƟ  on 
awarded the City of Birmingham a TIGER VII grant to build a bus rapid transit (BRT) system in three (3) disƟ  ncƟ ve travel corridors and 
the Birmingham City Center.  The provision of Federal funding to assist with the development of this important infrastructure component is a criƟ  cal catalyƟ  c element for the project.  The 
BRT itself is one of the larger catalyƟ  c elements 
intended to support, and in some cases help jump start, the redevelopment of impoverished neighborhoods.  The hope and promise of the BRT system is that it will usher in a new era of travel for the City of Birmingham; that it will strengthen the City’s diverse communiƟ  es 
by connecƟ  ng them to services and linking 
residents to opportuniƟ  es. However, the City’s 
transportaƟ  on transformaƟ  on does not end 
here as this is just the beginning.
Our Vision
Our vision is to uƟ  lize new transportaƟ  on 
and infrastructure technologies, Smart City elements, and innovaƟ  ve urban 
transportaƟ  on approaches to transform 
the City of Birmingham into a modern, thriving community that showcases the transformaƟ  onal power of the Smart City 
concept on mobility, accessibility, economic growth, land development, equity, and quality of life Meeting the Challenge to Become to Birmingham Rising
4The City of Birmingham is looking to remake 
itself into a 21st Century City.  Its leadership has a renewed commitment to the City’s growth and development, and is acƟ  vely 
seeking new ways to aƩ  ract new talent and 
business.  They know that in order to achieve the vision that they have set for Birmingham’s future and overcome its past deﬁ  cits, that they 
need to take bold acƟ  ons to remediate the 
City’s transportaƟ  on system.
The City of Birmingham has a strong desire for 
its transportaƟ  on system to establish a broad 
reach, linking the City and the region that it serves to new markets and desƟ  naƟ ons around 
the world. At the same Ɵ  me Birmingham’s 
leadership is seeking to take advantage of both the City’s geographic locaƟ  on and 
historic legacy as the “PiƩ  sburgh of the 
South”, building upon the exisƟ  ng inter-modal 
freight rail network, and capitalizing on its new interstate connecƟ  ons --gaining from the 
combined strengths of individual modes.
Birmingham’s vision for its transformaƟ  on 
reﬂ ect a city that is intelligent in character--
harnessing the tremendous power of digital social networks, elements of the sharing economy, and technological advancements to expand its economic and social capabiliƟ  es, 
and exploit its tremendous potenƟ  al.  It 
is inclusive in its services-- always moving forward, leaving no one behind. The transportaƟ  on system is innovaƟ  ve in its scope. 
It derives its beneﬁ  t from integrated data, 
technology and smarter use of its exisƟ  ng 
infrastructure.
The City of Birmingham’s vision is closely 
linked with the ideas expressed in both its comprehensive plan. The Comprehensive Plan holisƟ  cally addresses the development of its 
communiƟ  es, looking at economic condiƟ  ons, 
land development paƩ  erns and trends, 
transportaƟ  on needs, human health dispariƟ  es, 
and the overall quality of life. FacilitaƟ  ng community reinvestment, especially in the low-
income and minority neighborhoods, is one of the primary goals of Birmingham’s response to the Smart CiƟ  es Challenge. Through its 
inclusive planning process and strategic public investment, the City of Birmingham has set in moƟ  on an economic engine that is gaining 
the momentum needed to restore prosperity to Birmingham’s neighborhoods. The new construcƟ  on occurring in the Parkside District 
and Woodlawn are evidence that with targeted public investment community renewal is possible.
The City’s approach to catalyzing a renaissance 
of its neighborhoods is to center revitalizaƟ  on 
eﬀ orts around “strategic opportunity areas.” 
The strategic opportunity areas are acƟ  vity 
centers that contain the necessary economic, social, and transportaƟ  on resources to help 
them be successful.  The comprehensive plan calls for linking a number of strategic opportunity areas together along the BRT corridor like a string of pearls, and locaƟ  ng BRT 
staƟ ons within them.  This acknowledges the 
transformaƟ  ve power of transportaƟ  on, and is 
key to the City’s revitalizaƟ  on strategy. In short, 
the strategic opportunity areas are intended to serve mulƟ  ple funcƟ  ons, and are envisioned to 
be the catalysts for community reinvestment.  One of the funcƟ  ons intended for the strategic 
opportunity areas is for them to serve as “mobility hubs”. 
Mobility Hubs are an aƩ  empt to address the 
negaƟ  ves brought about by land development 
paƩ erns that responds exclusively to a single 
travel mode, the automobile, and whose supporƟ  ve infrastructure (i.e. wide, high-
speed arterial roadways, parking faciliƟ  es, 
etc.), discourages the movement and use of other transportaƟ  on modes.  They are places 
of connecƟ  vity where diﬀ  erent modes of 
transportaƟ  on – from walking to biking to 
transit to shared ride services – come together seamlessly. They also support intensive  Become America’s Next Smart City
5concentraƟ  ons of higher density development, 
accommodaƟ  ng places for people of all 
incomes, age, and ability to work, live, shop and/or play, and connecƟ  ng communiƟ  es to 
the rest of the region through reliable, rapid transit services. In essence, mobility hubs are acƟ vity centers that integrate land use and 
transportaƟ  on, and epitomize the City’s vision 
for its future.
Mobility hubs are hardly a household phrase. 
But the concept of a central places that links diﬀ erent modes of transportaƟ  on, as well as 
other things such as shopping, entertainment, recreaƟ  on and family services – is fundamental 
to the City of Birmingham’s vision for its revitalized communiƟ  es. They elevate the 
importance of public transit, cycling, and pedestrian travel. This elevaƟ  on of importance 
is criƟ  cal to ensuring the development of 
an eﬃ   cient, sustainable transportaƟ  on 
system. Public transit and non-motorized transportaƟ  on faciliƟ  es within the hubs help 
to reduce automobile travel, which impacts air quality. Equalizing and/or prioriƟ  zing cycling 
and pedestrian travel within mobility hubs also helps in addressing community health issues by providing employees, residents, and visitors to communiƟ  es that host mobility hubs the 
opportunity for walking and cycling. 
Mobility hubs are proposed t o be lo cated 
within neighborhood acƟ  vity centers, and are 
all about making it easier to move from one mode of transportaƟ  on to another, anchoring 
seamless, convenient connecƟ  ons across 
the metropolitan planning area. They’re also about improving the relaƟ  onship between 
transportaƟ  on and land use. There’s no point 
building a mobility hub in the proverbial “middle of nowhere.” In order for them to work, mobility hubs need t o be lo cated close 
to many people, whether they are at work, at home, or at play. In other words, they need to be livable.ComplemenƟ  ng the Birmingham BRT’s service 
design and capital investment, which will reduce the need for customers to travel to Birmingham’s downtown to transfer, mobility hubs will help customers access the BRT and other local transportaƟ  on opƟ  ons, as well as 
provide a viable, cost-eﬀ  ecƟ ve soluƟ  on for “last 
mile” connecƟ  ons.
Table 1 provides a descripƟ  on of how the 
mobility hubs are envisioned to work within the City of Birmingham.
IncorporaƟ  on of new technologies into the 
infrastructure, tesƟ  ng of automated and 
connected vehicle technologies, use of smart data collecƟ  on and sharing pracƟ  ces, smart 
land use, and user-focused mobility services are all of criƟ  cal importance to the successful 
implementaƟ  on of the Mobility Hubs concept.
Our vision is for the City of Birmingham to 
be a living laboratory for tesƟ  ng innovaƟ  ve 
transportaƟ  on concepts that will allow the City 
of Birmingham to close exisƟ  ng socioeconomic 
gaps that have been deﬁ  ning transportaƟ  on 
mobility, access to services, and growth opportuniƟ  es for years and provide enhanced 
transportaƟ  on opƟ  ons to move people 
and goods in a safer, more eﬃ   cient, more 
sustainable, and more equitable way. 
If selected for the Smart City Challenge, the 
City of Birmingham proposes to leverage exisƟ  ng resources, expand on recent 
transportaƟ
 on and urban planning iniƟ  aƟ ves, 
and introduce new technologies, strategies, and insƟ  tuƟ onal changes to address local 
transportaƟ  on challenges, spur economic 
development, and improve the quality of life for our ciƟ  zens. 
TransportaƟ  on opƟ  ons that are currently 
available or planned, and that will support the Mobility Hub concept include: Meeting the Challenge to Become to Birmingham Rising
6• Traﬃ  c Management Center (TMC) . The 
City of Birmingham operates a Traﬃ   c 
Management Cent er (TMC), lo cated 
in Birmingham’s City Hall. The TMC is designed to monitor traﬃ   c using 
CCTV cameras and control traﬃ   c signal 
intersecƟ  ons, and proacƟ  vely deploy 
traﬃ  c management strategies to reduce 
congesƟ  on during special events, 
emergencies, or daily stop-and-go traﬃ   c.  
• Public TransportaƟ  on. In 2015, the City of 
Birmingham applied for and subsequently won a U.S. Department of TransportaƟ  on 
TIGER VII grant to assist the City with the development of its long planned bus rapid transit (BRT) system. The BRT system will be the spine of a re-imagined transit system, where the BRT serves a series of mobility hubs, and local bus services feed the BRT system instead of running into a central locaƟ  on. The BRT is proposed to a 
10-minute frequency during the peak travel periods, and a 15-minute headway during the oﬀ  -peak periods.
• Local Bus Service improvements .  The 
Birmingham Jeﬀ  erson County Transit 
Authority also is undertaking a complete overhaul of its ﬁ  xed-route bus services. 
While the major improvements to local bus services are primarily focused on changes to routes, improvements also include technology upgrades such as automated vehicle locaƟ  on (AVL), real-Ɵ  me vehicle 
arrival systems, automated passenger counters (APC), and electronic payment systems.
• Car Sharing Program . The City of 
Birmingham hosts a car share program.  The University of Birmingham at Alabama (UAB) Car Share, is operated by a private enƟ ty and is currently limited to students 
and faculty at UAB.  Employed as part of the University’s congesƟ  on management 
strategy, the car share program provides these individuals who need a car for occasional use an opƟ  on to rent a vehicle 
for a short period of Ɵ  me.
• CommuteSmart . The City of Birmingham is 
an acƟ  ve partner in the Regional Planning 
Commission of Greater Birmingham’s CommuteSmart iniƟ  aƟ ve. CommuteSmart 
is a commuter services program that operates in the State of Alabama’s four (4) metropolitan transportaƟ  on management 
Table 1. Mobiliity Hub Typologies
Regional Mobility Hubs Serving mulƟ  ple communiƟ  es, regional mobility hubs serve regional 
acƟ vity centers and have the potenƟ  al for the highest levels of populaƟ  on 
and employment densiƟ  es, and that generate the highest levels of travel 
demand to and from these centers. PotenƟ  al transit travel modes include 
high-capacity public transportaƟ  on services such as Birmingham’s planned 
bus rapid transit (BRT) system, as well as express and local bu s services. 
Regional hubs are deﬁ  ned based on their scale, character, transit service 
availability and type, and funcƟ  on
Community Mobility Hubs Community scale mobility hubs serve majo r regional desƟ  naƟ ons and/
or funcƟ  onally important gateways that have inter-regional connecƟ  ons 
such as airports, emerging acƟ  vity centers, universiƟ  es and colleges, major 
parks and stadiums, and regional shopping centers
Neighborhood Mobility Hubs All staƟ  ons located on a high-capacity transit line, primarily providi ng 
access to both high-capacity and local transit services for nea rby residents 
in lower-density, single-use areas which were not included in p revious 
deﬁ niƟ ons. Become America’s Next Smart City
7area’s (TMA’s) i.e. Huntsville, Birmingham, 
Montgomery, and Mobile.  Within the Birmingham metropolitan planning area, CommuteSmart acƟ  vely supports and helps 
to maintain 35 vanpools.  They idenƟ  fy 
2,559 acƟ  ve carpools in the rideshare 
database.
• Commercial Shared Ride Services . The 
City of Birmingham recently passed an ordinance allowing shared ride services such as Uber and LyŌ   to operate within 
the City of Birmingham. Many of the City’s neighboring jurisdicƟ  ons followed suit soon 
aŌ er, noƟ  ng that it did not make sense 
for them to do so if Birmingham did not allow these services as Birmingham is the economic, cultural, and entertainment hub for the region.
• Inter-modal ConnecƟ  ons . The City of 
Birmingham is currently compleƟ  ng 
construcƟ  on on an inter-modal 
transportaƟ  on center in its downtown. 
The Birmingham Inter-modal Center will provide connecƟ  ons between local bus 
services, interregional and intercity bus services, passenger rail, taxi and shared ride services, bikeshare, and the City’s urban trail network.  
• Bikes Share StaƟ  ons/Bicycle FaciliƟ  es. 
Since 2015, the City of Birmingham is home to the Zyp Bikeshare program. Currently, Zyp Bikeshare is a dense network of kiosks and bikes whose exisƟ  ng services are 
primarily focused in Birmingham’s City Center and its adjacent neighborhoods.  Zyp has aspiraƟ  ons of expanding beyond 
downtown, and is looking to provide bikeshare across the City, as well as in neighboring ciƟ  es. The Zyp bikes are 
“smart bikes.” That is, the bicycles employ technology that knows where they are, and where they’ve been. Travelers can check their previous routes on the web or within Zyp Bikeshare’s app, a useful tool for individuals seeking to achieve a health goal, 
planning enƟ  Ɵ es looking to idenƟ  fy travel 
paƩ erns, or for folks who simply want to 
know where they have been. 
Along with state of the art bicycles, Zyp 
Bikeshare also employs sustainable docking staƟ ons. The staƟ  ons use clean energy, 
and are powered independently. Both the staƟ on and bikes are charged fully by solar 
panels. StaƟ  ons and bikes c ommuni cate 
with the larger network wirelessly. StaƟ  ons 
may be permanent. However, their design allows them to be portable so that they can be adapted temporarily for speciﬁ  c events.
The City of Birmingham envisions that 
Zyp Bikeshare staƟ  ons will be lo cated in 
