city	raw text	clean text	clusterid
to plan, design, implement, and evaluate iniƟ aƟ ves undertaken as part of the Smart 
City Challenge program. A collaboraƟ  on 
agreement between UAB and the City of Birmingham was signed in February 2013 and marked the beginning of this successful partnership which serves as a solid foundaƟ  on for the Smart City Challenge 
program. 
Through the UAB Sustainable Smart 
CiƟ es Research Center (SSCRC), UAB has 
an already established role as an engine of innovaƟ  on that can transform the 
community through the use of smart technologies and informaƟ  on systems, 
eﬀ ecƟ ve transportaƟ  on alternaƟ  ves, 
renewable energy opƟ  ons, and sustainable 
environment soluƟ  ons. The partnership 
between UAB Sustainable Smart CiƟ  es 
Research Center (UAB SSC) and the City of Birmingham creates excellent research, educaƟ  on, and training collaboraƟ  on 
opportuniƟ  es within a unique seƫ   ng where the city becomes a living laboratory 
for implementaƟ  on and tesƟ  ng of 
innovaƟ  ve research applicaƟ  on to beneﬁ  t 
the community.
Moreover, UAB is a University partner of 
the Southeast TransportaƟ  on Research, 
InnovaƟ  on and EducaƟ  on Center (STRIDE) 
a Regional University TransportaƟ  on 
Center (UTC) led by the University of Florida. STRIDE University partners devote their energies to three major focal areas: transportaƟ  on safety, livable communiƟ  es, 
and economic compeƟ  Ɵ veness which are 
directly related to Smart City Challenge program prioriƟ  es. UAB is also a member 
of the NaƟ  onal Center for TransportaƟ  on 
System ProducƟ  vity and Management 
(NCTSPM), a Tier 1 NaƟ  onal University 
TransportaƟ  on Center led by the Georgia 
InsƟ tute of Technology. 
 The well-established partnership 
between the City of Birmingham, UAB’s Sustainable Smart CiƟ  es Research Center, 
and the STRIDE and NCTSPM University TransportaƟ  on Centers as part of the Smart 
City Challenge will foster cross-disciplinary research, training, and outreach that will promote the development of innovaƟ  ve 
soluƟ  ons for sustainable smart ciƟ  es and 
communiƟ  es and disseminaƟ  on of ﬁ  ndings 
for the beneﬁ  t of transportaƟ  on agencies, 
professionals, and the public at large.
UAB’s commitment to economic 
development is also aligned with regional and state strategies, including “Blueprint Birmingham” — the community’s growth strategy led by Birmingham Business Alliance — and Accelerate Alabama, which seeks to drive recruitment of new projects, business retenƟ  on and develop home-
grown start-ups.
Figure 1 provides a graphic illustraƟ  on of the 
locaƟ  ons within the City of Birmingham where  Meeting the Challenge to Become to Birmingham Rising
18many of these Smart City concepts are desired.
It should be noted that this document only presents a high-level vision for the Birmingham’s proposed Smart City technology deployment. A detailed technical and management approach for realizing the aforemenƟ  oned vision, along with speciﬁ  cs 
about the implementaƟ  on requirements 
and the metrics to be used for quanƟ  ﬁ caƟ on 
and evaluaƟ  on of impacts associated with 
deployment and operaƟ  ons are outside the 
scope of the current solicitaƟ  on. 
Our Capacity
UAB Sustainable Smart CiƟ  es Research Center
As described previously, the Sustainable Smart CiƟ  es Research Center at the University 
of Alabama at Birmingham is an enabling plaƞ orm for interdisciplinary collaboraƟ  on 
to understand and transform the impact of urbanizaƟ  on at the scienƟ  ﬁ c, economic, and 
human levels. The UAB SSC provides avenues for:
• Training . UAB SSC trains researchers and 
leaders in the community, to advance the Science of CiƟ  es and sustainability in the 
urban seƫ   ng.
• Research . UAB SSC contributes to the 
development of the new Science of CiƟ  es 
by promoƟ  ng interdisciplinary research 
that seeks to understand the dynamics and impact of the built environment and technologies in the eﬃ   ciency of ciƟ  es and 
the quality of life of communiƟ  es.
• Outreach . UAB SSC educates the 
community on the elements of a sustainable smart city, and engages ciƟ  zens 
in transforming their built environment by acƟ  vely parƟ  cipaƟ  ng in the center’s 
research and educaƟ  on programs.
UAB Bill L. HarbertInsƟ tute for InnovaƟ  on and Entrepreneurship  
UAB’s InsƟ  tute for InnovaƟ  on and 
Entrepreneurship (IIE) improves the eﬃ   ciency 
and compeƟ  Ɵ veness of its research engine 
in an environment that fuels and sustains innovaƟ  on among faculty, researchers, 
students and community leaders. IIE helps to accelerate new company formaƟ  on and 
technology transfer through improved and ﬂ exible processes that build on successes of 
the UAB Research FoundaƟ  on (UABRF).  Since 
its incepƟ  on, UABRF has generated more than 
$64 million in licensing revenues and helped created 55 start-up companies based on products and technologies discovered at UAB.  IIE is bolstered by the InvenƟ  on-to-InnovaƟ  on 
(i2i) program. i2i is a joint eﬀ  ort by the School 
of Business, UAB Research FoundaƟ  on and 
Birmingham Business Alliance to market UAB assets with high commercial potenƟ  al.
InnovaƟ  on Depot
Opened in 2007, InnovaƟ  on Depot is an 
incubator and economic development program that hosts a shared co-work space facility in what was an abandoned Sears department store in the City’s Entrepreneurial Center just west of the city center. It is the Southeast’s premier technology business incubator, and is at the heart of Birmingham’s newly designated Eco-District. 
InnovaƟ  on Depot also host UAB’s Oﬃ   ce for 
the Advancement of Developing Industries. The 145,000 square foot space is designed to accommodate as many as 75 small businesses and up to 500 workers. However, demand has been high and there are currently 92 companies employing 540 people working under the InnovaƟ  on Depot banner. , In 
partnership with the City of Birmingham, InnovaƟ  on Depot conƟ  nues to work to support 
early stage technology companies, and has seen those it’s taken under its wing stay local. About 90% of the companies that go through the program stay close to home when they  Become America’s Next Smart City
19
Figure 1. Annotated Map of Smart CiƟ  es Challenge Technology and ProgrammaƟ  c DemonstraƟ  on Sites Meeting the Challenge to Become to Birmingham Rising
20graduate. Graduates of the InnovaƟ  on Depot 
include companies such as RFID and Motus, a motorcycle company that employs an in-house designed and patented V-4 engine. The engine that Motus designed and developed the world’s ﬁ  rst direct-inject, liquid cooled V-4 
engine.  The company now manufactures from a facility in downtown Birmingham.
Workforce Readiness
The City of Birmingham has long been commiƩ  ed to workforce development and 
training.  Lawson State Community College is locat ed in the City of Birmingham, and is 
accessible by public transit.  Considered to be a historically black college and university (HBCU), Lawson State is a parƟ  cipaƟ  ng member of the 
Alabama Center for AutomoƟ  ve Excellence, 
and oﬀ  ers three auto mechanics programs 
sponsored by manufacturers - Ford ASSET, GM ASEP and Toyota T-TEN. These programs are designed to helps address the demand for skilled automoƟ  ve technicians, and reduce the 
talent gap between jobs posted and available workers to ﬁ  ll them. Ranked among the top 
50 best community colleges in the country, and consistently ranked in the top 5 of this group, Lawson State Community College also is one of the NaƟ  onal AlternaƟ  ve Fuels Training 
ConsorƟ  um (NAFTC) aﬃ   liated NaƟ  onal Training 
Centers.  NAFTC includes a naƟ  onal network 
of NaƟ  onal Training Centers which are post-
secondary educaƟ  on and training organizaƟ  ons 
that provide vehicle instrucƟ  on and a 
demonstrated commitment to move towards providing instrucƟ  on in alternaƟ  ve fuels, 
alternaƟ  ve fueled vehicles (AFVs), advanced 
technology vehicles, and related technologies. Since 2009, Lawson State has been training mechanics speciﬁ  cally 
in the care and repair of AFV’s and advanced technology 
vehicles to include electric vehicles.  Lawson State also is a top supplier of skilled labor to Alabama’s automoƟ  ve industry, and graduates 
have found gainful employment with Mercedes Benz U.S.A., Hyundai America, Toyota, and Nissan.
In 2011, Lawson State Community College 
was recognized by the Obama AdministraƟ  on 
as a Champion of Change for its work with developing the next generaƟ  on of skilled labor 
and providing a successful bridge between vocaƟ  onal and academic educaƟ  on. 
Lawson State Community College’s Birmingham 
campus will link directly with the Birmingham BRT, host a mobility hub, and connect to other area mobility hub(s) that are currently being planned as part of the City’s comprehensive planning process. It’s Bessemer campus will link with the BRT corridor as it expands west in future phases.
In addiƟ  on to training mechanics, there is a 
statewide push to by the Alabama Technology Network, the Alabama Industrial Development Training, and community colleges are trying to accelerate teaching speciﬁ  c technical 
skills. This includes teaching computer coding skills. Code.org, is naƟ  onal organizaƟ  on 
focused on increasing access to computer science educaƟ  on. Code.org is partnering 
with A+ College Ready and the Alabama State Department of EducaƟ  on, and will invest 
$500,000 to build on Alabama’s eﬀ  orts to 
expand computer science courses in K-12 classrooms across the state. The investment will double the number of Alabama teachers 
qualiﬁ  ed and trained to teach 
computer science in the state’s public schools. 
Our Commitment
Leadership. Since becoming 
Mayor of Birmingham in 2010, 
 Become America’s Next Smart City
21William A. Bell, Sr. has steered the City into a 
new and exciƟ  ng direcƟ  on. AŌ  er inheriƟ  ng a 
$77 million budget deﬁ  cit, Mayor Bell quickly 
took control and began transforming the City, bringing about a renaissance of development and culture, and ushering in a new era of economic prosperity.
Under Mayor Bell’s leadership, Birmingham 
has made key strategic investments to spark growth and revitalizaƟ  on. The development of 
a new downtown baseball stadium -- Regions Field-- the Negro Southern League Museum, and conƟ  nued support of Railroad park has 
brought hundreds of millions of dollars of private investment to the thriving Parkside district and returned baseball to the City of Birmingham. Other investments, such as the Birmingham Crossplex, the Uptown Entertainment District, and implementaƟ  on of 
the Red Rock Ridge and Valley Trail System are 
currently spurring residenƟ  al and commercial 
growth in throughout the city.
Numerous corporaƟ  ons have r elocated to 
Birmingham or renewed their commitment to stay in Birmingham. This includes Healthsouth, Steris, Kamtech among others.
In 2013, Mayor Bell signed a memorandum 
of understanding with the University of Alabama at Birmingham Sustainable Smart CiƟ es Research Center to partner on projects 
that would make Birmingham a more livable city. Through this partnership, Birmingham received one of 16  (one of four in the United States) IBM 2014 Smarter CiƟ  es Challenge 
Grants aimed at eliminaƟ  ng food deserts in 
Birmingham.
Mayor Bell is not only changing the face 
of Birmingham locally, he is Birmingham’s ambassador to the world. He has served as president of the African American Mayors AssociaƟ  on (AAMA), co-chairing the U.S. 
Conference of Mayors CommiƩ  ee on Human Rights. He is also co-chair of “My Brothers 
Keeper,” an iniƟ  aƟ ve by the U.S. Conference of 
Mayors and President Barack Obama.
The Sharing 
Economy . The City 
of Birmingham is commiƩ  ed to the 
developing of its sharing economy, and will conƟ  nue 
to integrate transportaƟ  on 
technology soluƟ  ons 
so that they support these highly ﬂ exible economic 
networks.  The City already has made it easier to share resources on demand, supporƟ  ng 
the development of the awarding winning InnovaƟ  on Depot.
The City has supported the development 
of other co-working spaces such as REV Birmingham’s SocialVenture and 55th Place Arts.  SocialVenture is a f acility lo cated in the 
historic Woodlawn neighborhood that oﬀ  ers 
Birmingham’s entrepreneurs, non-proﬁ  ts 
and start-ups shared oﬃ   ce and retail space, 
and a divisible space to house meeƟ  ngs, 
workshops and recepƟ  ons.  55th Place Arts 
oﬀ ers customizable studio workspace for 
arƟ sts, makers, and other creaƟ  ves. All of these 
faciliƟ  es -- InnovaƟ  on Depot, SocialVenture, 
and 55th Place Arts -- are lo cated in proposed 
mobility hub locaƟ  ons. InnovaƟ  on Depot 
already has access to the Zyp Bikeshare program.; the other two locaƟ  ons are 
proposed to have access to Zyp Bikeshare and BRT.
In addiƟ  on to supporƟ  ng co-working space, the 
City of Birmingham also supports the Urban Food Project. The Urban Food Project aims to build a robust local food economy while creaƟ  ng healthy food access. The program 
 Meeting the Challenge to Become to Birmingham Rising
22assists corner store owners with shared 
resources that help them to purchase, market, market, and sell of fresh produce. The Urban Food Project addresses Birmingham’s food desert problems by assisƟ  ng Alabama’s farmers 
plan their crops and access underserved markets i.e. Birmingham’s food deserts, providing delivery services of quality produce to neighborhood restaurants and corner stores.
Finally, the City is supporƟ  ve of the sharing 
economy in that rideshare companies such as Uber, and LyŌ  , as well as apartment/
house sharing companies such as Air BnB are all now permiƩ  ed to operate within City 
limits.  Because Birmingham is the largest city in Alabama, its agreement to allow these businesses to operate within the City has opened up the sharing economy’s market to the enƟ  re Central Alabama region.
Our Process
Decision-Makers . A decision structure has 
been established that includes input from each of our key team members. A risk reward matrix will be established to allow the ranking of idenƟ  ﬁ ed components and opƟ  ons for speciﬁ  c 
projects during program implementaƟ  on.  
Each strategy and implementaƟ  on plan will be 
submiƩ  ed to the commiƩ  ee for review and 
ranked against the objecƟ  ve of the Smart CiƟ  es 
Challenge, as well as the available resources for implementaƟ  on.  Key decision factors 
include: a) opƟ  mizaƟ  on of exisƟ  ng assets, b) 
integraƟ  on with other program components, 
c) expandability, d) transferability, and e) the ability to advance Smart CiƟ  es Challenge 
objecƟ  ves speciﬁ  cally for mobility hub. This 
approach will allow for diverse input for selecƟ  on of technologies and approaches that 
best advance the City of Birmingham’s overall Smart CiƟ  es program, and generate outcomes 
with the maximum beneﬁ  t for the City. This 
approach also will idenƟ  fy acƟ  viƟ es that can 
be implemented in other jurisdicƟ  ons and naƟ onwide.
Each team member will idenƟ  fy one 
representaƟ  ve to serve on the commiƩ  ee 
and assist with alternaƟ  ve selecƟ  on. The 
commiƩ  ee will be chaired by the Mayor’s 
oﬃ  ce.
Program Management . The Program 
Management structure for the Smart CiƟ  es 
Challenge program will be put in-place from the iniƟ  al formulaƟ  on of the program’s 
objecƟ  ves, and will be implemented 
conƟ  nuously through the closeout of the 
program.  The Program Management Team will include:
• ndividual Project Management Plans
• Program Scheduling
• Financial Management
• Value Engineering
Our Risks
There are several potenƟ  al technical, policy, 
and insƟ  tuƟ onal risks associated with the 
deployment of the City of Birmingham’s Smart CiƟ es Challenge vision. While the risks are 
many and varied, most all of them might be avoided and miƟ  gated through thoughƞ  ul 
and careful preparaƟ  on, transparency, and 
educaƟ  on.  The decision -making and program 
management structure is designed to address many of the risks idenƟ  ﬁ ed herein. 
Our Systems
TransportaƟ  on Infrastructure . As of May, 
2014, the Birmingham metropolitan planning area’s funcƟ  onally classiﬁ  ed roadways were 
comprised of: Become America’s Next Smart City
23Transit Services . IFixed route and paratransit 
services are provided to the City of Birmingham by the Birmingham Jeﬀ  erson 
County Transit Authority (BJCTA). BJCTA operates 35 routes consisƟ  ng of a) 29 ﬁ  xed 
route marketed as MAX, b) one express route, c) two neighborhood circulators, d) one specialty shuƩ  le servicing the Birmingham-
ShuƩ  lesworth InternaƟ  onal Airport, and e) two 
downtown circulator routes.  All ﬁ  xed-route 
and paratransit services operate Monday through Friday between 4am and 11:30pm, and on Saturdays between 4am and midnight.  No services are provided on Sunday.
Shared Use Mobility Services . Several shared-
use mobility services are currently available in the City of Birmingham. Examples include Zyp Bikeshare, car sharing, CommuteSmart, and Commercial Shared Ride Services. Details about those services are available in “Our 
Vision”.
InformaƟ  on and CommunicaƟ  on Technology
The City of Birmingham is in the process of upgrading all its IT infrastructure that adhere to security guidelines and allows for a more robust and secure network plaƞ  orm. The 
City has already deployed VoIP (voice over internet protocol) communicaƟ  ons across the 
board with integrated uniﬁ  ed communicaƟ  ons 
systems.  Several ERP (enterprise resource planning) systems are already in place speciﬁ  c 
to ﬁ nance, public safety (police, ﬁ  re, courts), 
human resources, document imaging, body cameras for police personnel, and the ESRI GIS mapping system which integrates with our other ERP systems.
The City of Birmingham has already completed 
the required infrastructure, including the ﬁ  ber 
opƟ cs layout, to support NG 911 systems.  The 
Table 3. IdenƟ  ﬁ ed Risks to Successful ImplementaƟ  on of Smart CiƟ  es Challenge
Risk Type DescripƟ  on
TechnicalInfrastructure Readiness. Ability of keep infrastructure update d to accom-
modate new technologyTechnology IntegraƟ  on. IntegraƟ  on of mulƟ  ple transportaƟ  on systems and 
components
PoliƟ  calConƟ  nuity. While the City has enjoyed conƟ  nuity in its leadership since 
2010, potenƟ  al turnover in elected and business leadership could threat-
en the Smart CiƟ  es iniƟ  aƟ ves
Control. There are mulƟ  ple enƟ  Ɵ es that control the diﬀ  erent component 
of the transportaƟ  on system that do not necessarily share the same vision
PolicyAlignment. ExisƟ  ng city plans for transportaƟ  on and other criƟ  cal infra-
structure with Smart CiƟ  es concepts is criƟ  cal to success
FundingFunding Availability. Availability of funding in addiƟ  on to monies awarded 
through the Smart CiƟ  es Challenge for implementaƟ  on could be challeng-
ingFunding Adequacy. Even if funding is provided, ensuring their a dequacy to 
advance all of the Smart CiƟ  es concepts might pose challenges
InsƟ tuƟ onalLegacy System Management. Management of legacy systems during t ran-
siƟ on to new transportaƟ  on concepts could be challenging, parƟ  cularly 
around infrastructure maintenance.EducaƟ  on. EducaƟ  on of stakeholders and public about the fundamental 
change to transportaƟ  on needs to be conƟ  nuous and clear Meeting the Challenge to Become to Birmingham Rising
24City also has a built a traﬃ   c control center to 
maintain and monitor (24X7) more than 700 traﬃ  c intersecƟ  ons.
The City recently updated its web presence, 
incorporaƟ  ng a majority of “eServices” 
including: online business tax payment, parking Ɵ cket and traﬃ   c ﬁ ne payment, food truck 
vendor applicaƟ  on, etc.  An associated web 
app has been developed as well.  The City of Birmingham has also developed a public service web portal that will be launched in the near future.
Finally, the City of Birmingham is considering a 
GIG (gigabit) ﬁ  ber network “self-healing” ring 
deployment to the City as a whole that will provide high bandwidth internet connecƟ  vity 
to all City businesses and the public as well.
Intelligent TransportaƟ  on Systems . The City 
of Birmingham operates a Traﬃ   c Management 
Center (TMC) which is uƟ  lizing CCTV cameras 
to monitor traﬃ   c condiƟ  ons and control traﬃ   c 
signal intersecƟ  ons remotely in response to 
recurrent and non-recurrent congesƟ  on.  The 
TMC was updated in 2012 to include a new video wall, Ethernet switch, video management soŌ ware, work staƟ  ons, encoders, Ɵ  me servers 
and video wall servers.  This center is designed and set up to manage copper and ﬁ  ber cable 
plants.  It is the City of Birmingham’s goal to work in a mulƟ  agency/mulƟ  jurisdicƟ  onal 
manner so that the TMC’s reach might extend beyond the City’s boundaries, and aid with monitoring and collecƟ  ng informaƟ  on about the enƟ  re transportaƟ  on system using its 
network of sensors, cameras, and other technology.
ITS Architecture and Data Standards . 
Intelligent TransportaƟ  on Syst ems (ITS) present 
stakeholders with a variety of opƟ  ons in order 
to address a variety of transportaƟ  on needs. 
The framework provided by the NaƟ  onal ITS 
Architecture makes system, product, and service compaƟ  bility possible, without limiƟ  ng 
the design opƟ  ons of the stakeholder. As 
connected and automated vehicles emerge, expansion of the NaƟ  onal ITS Architecture 
and Standards is needed to provide the necessary guidance so that stakeholders develop systems soluƟ  ons that are compaƟ  ble 
in order to share data, provide coordinated, area-wide integrated operaƟ  ons; and support 
interoperable equipment and services where appropriate. The Connected Vehicle Reference ImplementaƟ  on (CVRIA) was developed to 
address this need.
As a Smart City, the City of Birmingham 
is commiƩ  ed to using the NaƟ  onal ITS 
Architecture and Standards as well as CVRIA guidelines to deﬁ  ne operaƟ  onal, user, Table 4. Birmingham Roadway System DescripƟ  on
FuncƟ  onal Classiﬁ  caƟ onRegion
(center line mles)Birmingham
(center line miles)Percent of Total
Freeway 196 37 18.8%
Principal Arterial 225 46 20.4%Minor Arterial 612 147 24.0%Major and Minor Collectors 1,320 145 10.9%
 Become America’s Next Smart City
25performance, and program requirements 
for the deployment of ITS technologies and connected/automated vehicle technologies as part of the implementaƟ  on process. 
Furthermore, the research team will document any exisƟ  ng gaps with respect to 
the use of currently available architecture, standards, and protocols in an eﬀ  ort to inform 
USDOT and standard seƫ   ng organizaƟ  ons 
about further needs for reﬁ  nement or 
development of new standards to support the adopƟ  on of interoperable architectures and 
integrated, fully open systems.
Our Data
Data Availability . To date, most of the data 
collected by the City has been historical travel data used for forecasƟ  ng and 
planning purposes. For the roadway system, Birmingham currently collects traﬃ   c counts, 
travel speed data, travel Ɵ  me data, and 
informaƟ  on on incidents and crashes. For 
transit, the City collects ridership data. For pedestrians and bicycles, the City has begun an eﬀ  ort to collect data on these modes 
through pedestrian facility counts. Automated data from the Zyp Bikeshare program is also now available and providing useful data on biking paƩ  erns in the City. Data are currently 
analyzed and warehoused at the Regional TransportaƟ  on Data Center, a partnership 
between the Regional Planning Commission and UAB.
 Data CollecƟ  on. The City will conƟ  nue its 
current data collecƟ  on eﬀ  orts in the future, 
but the goal as Birmingham moves forward will be to focus on:
• CollecƟ  ng more data from mulƟ  ple modes 
and sources
• IntegraƟ  ng data from other databases 
(e.g., medical, geospaƟ  al)
• CollecƟ  ng and analyzing data in real-Ɵ  me
• CollecƟ  ng data more eﬃ   ciently by using personal technologies and the smart city 
infrastructure to automate data collecƟ  on
• DistribuƟ  ng data and analysis in real-Ɵ  me 
to ciƟ  zens and stakeholder
These addiƟ  onal data will allow the City to 
beƩ er monitor the complete transportaƟ  on 
system in real Ɵ  me and shiŌ   resources as 
needed to accommodate changing demand or condiƟ  ons. This will require real-Ɵ  me data 
analyƟ  cs and distribuƟ  on, something for w 
hich the Data Center is beginning to plan.
Data Warehousing . Data will conƟ  nue to be 
stored, analyzed, and distributed from the Regional TransportaƟ  on Data Center. The 
addiƟ  on of the UAB Big Data AnalyƟ  cs Lab as a 
partner will enhance this eﬀ  ort.
Data Sharing . Because of the proprietary 
nature of so much transportaƟ  on data, 
sharing of data has been diﬃ   cult in the 
past.  Travel Ɵ  me data provided by the U.S. 
government, for example, cannot be easily shared with outside enƟ  Ɵ es due to ownership 
agreements. Similarly, freight data are considered proprietary by private carriers, who are reluctant to release any data related to actual types of freight moved. Even greater barriers exist with community health data, where personal privacy is paramount. One of the iniƟ  al, and potenƟ  ally most diﬃ   cult, tasks 
for the data center moving forward will be to assess these data sharing hurdles and idenƟ  fy 
