city	raw text	clean text	clusterid
universities will pave the way for future implementation in similarly sized and larger cities.  
Bridj Bridj is a transportation system that adapts in real time to where your pick up and drop off location . A 
pilot program between Bridj and KCATA is being developed  which will integrate into the Smart City.   
Freight 
Partnerships  Freight partnerships with companies like DHL and FedEx will be key when developing smart city 
concepts around the vision Urban Delivery and Logistics .  
Google  Kansas City was the first city to receive Google Fiber, Google’s broadband internet and cable te levision 
service. Kansas City will be able to integrate Google’s fiber optics in the Smart City.  
Integrated 
Roadways  Kansas City -based small business develop  innovative  pavement systems including  off site construction, 
compartmentalized installation and integrated digital sensors that will work with current  sensor systems.  
Intel  A partnership with I ntel will help Kansas City’s Smart City Manage  IOT logistics.  
KC Next  KC Next is a network of  multinational co rporations and entrepreneurs in tech industries  (health care IT, 
telecommun ications, digital media, etc.). Their network will help spread Kansas City’s  Smart City  vision . 
KCP&L  Kansas City Power and Light Company is an electric utility company serving the Kansas City 
metropolitan area. KCP&L will play an integral part the Smart City’s smart grid system.  
Rhythm 
Engineering  Rhythm Engineering is traffic software and engineering firm that develops real -time adaptive traffic 
control system s that enable  traffic signals to immediately adapt to tra ffic demand. This software could 
help fully integrated traffic signals into the Smart City.   
 
   City of Kansas City, MO – Smart City Vision Proposal  22 | P a g e  
 8. EXISTING TRANSPORTATION INFRASTRUCTURE  
Kansas City’s existing transportation infrastructure provides unique opportunities to capitalize on several 
smart city initiatives. Utilizing an established ITS infrastructure  and strategic partnerships  (e.g., Google) , 
Kansas City  is poised to expand and i ncrease its mobility services, leverage the current infrastructure to  
effectively i mplement AV/CV and data analytics technologies, and capitalize on current and on -going efforts 
to advance  information sharing and data dissemination to improve transportatio n operations and services.  
Table 8-1: Existing Kansas City Transportation Infrastructure  
Kansas City 
Infrastructure  Details  
Arterial Miles  ● Principal arterials and major collector roads: 4,000 lane -miles (1,745 centerline)  
● Minor arterials, minor collector roads, and local streets: 2,000 lane -miles (975 centerline)  
● Supports over 15 million urban area daily vehicle miles of travel  
Freeway Miles  ● Interstates and expressways: 2,000 lane -miles (400 centerline)  
● Supports over 21.5 million urban area daily vehicle miles of travel  
● Serves over 70% of the vehicle miles traveled in the Kansas City metropolitan area  
● Contains the most freeway lanes per capita of any other city in the U nited States  
● One of only six cities in the country with four primary interstate highways  within city limits  
Transit Services  Kansas City Area Transportation Authority (KCATA)  
● 54,000 daily boardings  
● 646 miles of regular bus service on 58 routes  
● 25 miles of bus rapid transit on two routes  with a third BRT in Project Development  
o Provides faster, more frequent service, and features information markers at well -lit 
stations showing real -time arrival information  
o Kansas City Streetcar Authority  
● Two-mile streetcar line scheduled for opening Spring 2016  
Shared -Use Mobility 
Services  ● Bike sharing:  
o Designed for short trips  
o Compliments transit system  
o Provides low cost access to jobs and services  
o Logged over 19,000 bike trips, totaling 64,000 miles traveled  
● Car sharing:  
o Aimed at individuals who only require the use of a vehicle for a short time  
o Services available at University of Missouri -Kansas City  
o Services available at Kansas City International airport  
● Other ride sharing  
o Uber  
o Traditional taxi services  
Information and 
Communication 
Technology (ICT)  ● 3rd largest increase overall in high -tech startup density  
● Ranked 1st in the nation for highest increase in high -tech startup density related to ICT  
Intelligent 
Transportation Systems 
(ITS)  ● Kansas City Scout  
o Manages traffic on more than 125 miles of freeway  
o CCTV cameras  
o Traffic flow sensors  
o Electronic message boards  
o Bi-state  traffic management center  
o Highway Advisory Radio (HAR)   City of Kansas City, MO – Smart City Vision Proposal  23 | P a g e  
 o My KC Scout traveler information app  
● Ramp metering  
o Reductions in overall accidents by 64%  
o Reductions in merging -type crashes by 81%  
o Improvements in consistent travel times and speeds  
● Operation Green Light  
o Helps synchronize traffic signals on major routes  
o Reduced delays on coordinated routes by an average of 17%  
o Allows analysts to make changes to signalization from a centralized office  
o Allows for future adjustments/changes in the way roadways are used (e.g., to account 
for varying levels of pedestrian, bicyclist, and/or public transportation users)  
● Weather -Response System (WRS)  
o Supports weather -responsive transportation operations  
o Allows  users to select desired conditions and determine when such conditions are 
predicted for a specified area  
o Useful for scheduling incident response staff/operations and managing traffic operations 
before and during adverse weather  
● Environmental Sensor Statio ns (ESS)  
o Collects road surface condition, road/bridge surface temperature, precipitation rate, wind 
speed, air temperature, humidity, subsurface temperatures, dew point, barometric 
pressure, and visibility  
Smart Grid 
Infrastructure  ● Partnered with Google to receive and implement Google Fiber, Google’s ultra -fast, one -
gigabit -per-second broadband internet access  
● Clean Charge Network, the largest electric vehicle charging operation in the U nited States  
o Consists of over 1,000 electric vehicle charging stations  
o Capable of supporting more than 10,000 electric vehicles  
o Offers free charging on every station to all drivers for the first two years  
o Fast charging stations – charge  vehicles from empty to 80% in about 30 minutes  
o Standard stations – provide  most e lectric vehicles with a 25 -mile charge per hour  
9. DATA NEEDS AND AVAILABILITY  
9.1 Current Data Collection Effort s and Data Policies  
Kansas City currently collects a broad range of data relating to city service operations and assets. Many key 
data sets are  provided in a machine readable format through the City’s open data portal, Open Data KC. The 
City’s Data Governance Committee is currently undertaking a department -by-department data inventory to 
identify and prioritize other high value datasets for publi c release.  
 
Open Data KC also helps to feed the city’s public -facing performance management program, KCStat. KCStat 
focuses on monitoring the City's progress toward its Five -Year Citywide Business Plan through monthly 
meetings as well as the KCStat  Dashboard, which provides an ""at -a-glance"" view of the Business Plan’s 
goals, objectives, and metrics.  Underlying KCStat and the city’s strategic goals, DepartmentStat is a 
collaborative effort between the City Manager’s Office and key service departments  to utilize data -driven 
management to meet departments’ goals. Not only does this effort focus on building capacity for data 
analysis, but these operational goals also are foundational for the city’s pursuit of its strategic goals.  
 
Kansas City has partnered with What Works Cities , a national initiative to help 100 mid -sized cities enhance 
use of data and evidence to engage residents, make government more effective, and improve residents’  City of Kansas City, MO – Smart City Vision Proposal  24 | P a g e  
 lives. This partnership has led to greatly expand ing the  existing open data efforts in alignment with best 
practices. The city also recently passed a revised Open Data policy which created the position of Chief Data 
Officer, extends open data to component units, and required more accountability from departments on 
opening up data. This new policy helped form a Data Governance Committee to build internal data capacity, 
stewardship, and utilization. After reviewing against privacy policies, new data and information generated 
during the Smart City Challenge will be share d with the appropriate partners such as KCATA and KC Scout, 
as well as published to Open Data KC and KCStat.  
 
9.2 New Data Collection  and Integration  
Kansas City proposes to collect multiple new data sets during the Smart City Challenge including , but not 
limited to,  gunshot detection, vehicle situation, social media , transit user volum es, and population movement 
data. This data will be used to optimize transportation services as well as to feed  the data analytics platforms 
discussed in the Urban Analytics vision element. A data bus will be developed to receive data feeds from 
new intelligent infrastructure, sensors, CV, AV, and potential partner s (e.g., ride -hailing companies). As with 
all other systems, the data bus will be developed with privacy and secur ity as primary objectives, while 
providing machine -readable, real -time application program interfaces.  Kansas City will manage this new data 
with team partners and share as appropriate  with Open Data KC based on open data policies to fuel 
entrepreneurship and innovation . When integrated, existing and new data will be used by partners and 
transportation providers and managers such as KCATA and KC Scout. The newly integrated data will be 
used to address further city challenges and  improve the quality of life for all citi zens by making  city service 
delivery more customized, targeted and seamless . 
 
Kansas City will work with other entities to integrate data to provide synergies for urban ana lytics by 
innovative applications. The integration of data currently takes place through algorithms developed by City 
of Kansas City Office of Performance Management or developed by a contractor supporting that office. In 
the Smart City Challenge, the Offi ce of Performance Management will work with partners to create a data 
hub that will integrate data from multiple organizations into a single platform. This new system will provide 
data in a machine -readable format, a portal for developers to build applicat ions and tools, and data logs for 
interested parties to conduct research.  
 
Integrating data with KCATA and KC Scout could realize huge benefits in optimizing transportation services 
and investment in t ransportation  services and necessary infrastructure.  Other benefits of integrating data 
from existing and proposed new sources include:  
 Gunshot detection data will be integrated with data on patrol car usage to improve public safety and 
better use of assets  
 Population density data may lead to changes in educat ion, training and aid agency planning activities  
 Population density data may also encourage business development on Prospect MAX corridor, 
especially with increased public safety that is data supported  
 
9.5 Cross -cutting Partnership  
Kansas City plans to develop partnerships to share data with KCATA, KC Scout, and other potential partners 
such as ride -hailing companies to improve urban analytics and services. By establishing partnerships and 
sharing data with other transportation provi ders and related organizations, Kansas City will be able to more 
effectively identify problem areas (e.g., congested corridors, unsafe intersections) within the urban 
transportation system. Th is new data could be used to furt her identify areas to deploy  V2I technologies , 
improve Operation Green Light traffic signal management,  and implement smart land use initiatives such as  City of Kansas City, MO – Smart City Vision Proposal  25 | P a g e  
 road diets. In establishing partnerships, Kansas City will analyze the data to be shared to determine the 
necessarily controls to prot ect the privacy interests of citizens and public security.  
 
Kansas City is also currently partnered with  UseAgility, a local UX firm, through the Mayor’s Challenge 
Cabinet to test potential redesigns of the Open Data homepage.  Kansas City will continue to work with this 
firm throughout the Smart City Challenge to integrate new data to the homepage.  
10. ITS AND CV STANDARDS /ARCHITECTURE  
The National ITS Architecture is a mature architecture that provides a common framework for the ITS 
community to plan, define, and integrate ITS solutions. The Connected Vehicle Reference Implementation 
(CVRIA) was developed to extend the National Architec ture to include detailed information to support 
development of fully interoperable regional connected vehicle architectures. The CVRIA and the associated 
SET-IT software tool will be fully integrated into the National ITS Architecture and software toolset to support 
development of interoperable architectures including complete ITS infrastructure and connected vehicle 
capabilities along with interface information needed for standards selection. The CVRIA is based on a set of 
applications defined by various c onnected vehicle programs. The source for all the application descriptions 
ranges from ConOps , Requirements Specifications, or existing Standards and Architectures.  
CVRIA has a list of CV applications grouped according to: environment, mobility, sa fety, a nd support needs. 
Once an application is selected, a description of the application is provided, as well as a physical diagram 
(as seen  in Figure 10-1). The physical diagram identifies the type of hardware required, and categorizes the 
hardware into groups . 
Kansas City will heavily rely on CVRIA and its own regional ITS Architecture to identify relevant applications 
and technolog ies to: reduce congestion, keep  travelers safe, protect the environment, respond to climate 
change, connect underserved communitie s, and support economic vitality. CVRIA will allow Kansas City to 
identify the type of application  and hardware required to implement the application.  
Figure 10-1: CVRIA Physical View which describes the connections between Physical Objects 
within the CV Environment for a specific application  
 
The Kansas City Regional ITS Architecture will help the deployment of interoperable systems without 
impeding innovation as technology advances, vendors change, and new approaches evolve. The regional 
architecture is  built upon standard documents f rom organizations such as AASHTO, ITE, NEMA, APTA, 
ASTM, IEEE , and SAE. An example of a regional standard that will be used to help Smarty City development 
in Kansas City is the ASTM E2468 -05: Standard Practice for Metadata to Support Archived Data 
 City of Kansas City, MO – Smart City Vision Proposal  26 | P a g e  
 Management Systems. This standard includes , but is not limited to , data management standards for  
RIDESHARE, KDOT Traffic Data Warehouse, KDOT KanRoad Reporting System , KCMO Parking 
Management, KCATA Operations Center, and Kansas Ci ty Scout Operations Center.  
11. MEASURABLE GOALS AND OBJECTIVES  
Kansas City’s technology initiatives are a catalyst for connecting communities and fostering economic 
development. Currently tracked k ey metrics, in terms  of progress, are geared toward  building  the capacity to 
plan and track smart city process and engagement. Table 11-1 captures the current KCMO Digital Roadmap 
goal categories, as well as the objectives, and potential metric s, aligned to goals,  to measure success.  
Table 11-1: Overview of Digital Roadmap Goals  
Category  Goals  Metrics  
Digital 
Inclusion  1.) Develop a City -wide digital inclusion policy 
aimed at bridging Kansas City’s digital divide.  
2.) Develop City -wide digital strategies to increase 
public access to free Wi -Fi, and to manage 
public infrastructure.  
3.) Improve approaches to technology procurement 
with a focus  on digital literacy, professional skills, 
communications, operations and service delivery  1.) The Republic’s Center for Digital Government 
ranking for digital cities  
2.) Number of Sprint Pub lic Wi -Fi hotspots and City 
Post Kiosks  
3.) Percentage of use of hotspots and kiosks  
4.) Living Lab and KC Smart City 
Workshop/Number of Industry Partners  
Open 
Government  1.) Make data more accessible to residents . 
2.) Develop strategies and supporting policies to 
identify and provide data that is most valuable to 
the community.  
3.) Enhance operations by ensuring timely delivery 
of data and internal collaboration.  1.) KC Digital Drive and creation of data portals 
(like KC Open Data Portal )/Open Data Catalog  
2.) Number of data d ictionaries and visualization 
standards to identify useful info in apps such as 
Open Data Catalog  
3.) Number of application s launched to navigate 
annual budget and government processes  
Engagement  1.) Build on the initial success of 311 and other 
digital engagement platforms.  
2.) Enhance mobile accessibility of digital services 
and information.  
3.) Focus on implementing best practices and 
support feedback from the community.  1.) Number of 311 application updates  
2.) Number of employees cross -trained in digital 
resources  
3.) SMART, team of social media leaders, to collect 
feedback  
Industry  1.) Support technology startup infrastructure.  
2.) Foster sustainable partnerships with regional 
academic institutions.  
3.) Create a smart city living lab to enable 
entrepreneurs to test ideas in Kansas  City. 1.) Number of partnerships and programs to 
provide a platform for start -ups (like Living Lab)  
2.) Number of university partners  
3.) Number participants in the Living 
Lab/Innovation Partnership Program  
Smart City  1.) Establish a Smart City advisory structure to 
benchmark and measure the success of Kansas 
City’s Smart City infrastructure investment.  
2.) Leverage data and analytics to drive 
performance management, and explore the 
potential  of predictive modeling  to work smarter.  
3.) Embrace a paperless City Hall by developing  a 
priority list of digitizing processes.  1.) Number of successfully completed projects that 
were supervised by the advisory board  
2.) Number of sensors and size of real -time data 
which monitor real -size data  
3.) Percent reduction in paper consumption  
  City of Kansas City, MO – Smart City Vision Proposal  27 | P a g e  
 For the three pillars of our Smart City vision, we will leverage the current goals and metrics, as well as develop 
more detailed ones that will measure the effectiveness of our efforts along a broad spectrum of outcomes.  
These outcomes will include traditional transport ation measures, such as throughput, numbers of incidents, 
and overall performance of the system with new measures and outcomes that address the intended goals of 
the Smart City Challenge, including but not limited to:  
 Use of new technologies (kiosks, tran sit applications, connected vehicle applications, etc.)  
 Satisfaction with new technologies  
 Usage of expanded transit options  
 Economic development that can in some way be tied to new deployments  
 Changes in air quality and congestion  
 Efficiency of the frei ght system  
 Safety along the Pros pect Ave C orridor  
 Number  of start -ups participating in the new initiatives  
 Number of t raffic collisions  
 Accessibility for the visually impaired  
 
Kansas City has already been working with other cities and partners to better  understand traditional 
approaches to measuring the technology deployment around smart cities. Kansas City has utilized our Smart 
Cities framework to illustrate key data points for reference. The current Kansas City deployments and vision  
contain five dime nsions which are used to measure goals and objectives. The five goals are: Environment, 
Mobility, Government, Society, and Quality of Life. Kansas City will use these and additional goals and 
measures during our Smart City Challenge deployment. The table b elow include s the measures for the five 
goal areas.  
Table 11-2: Current  Performance Measures  
Dimension  Working Area   Indicator   Description  
Environment  Smart Buildings  Sustainability -certified 
Buildings  Number of LEED or BREAM sustainability 
certified buildings in the city  
Resources Management  Total Energy Consumption  Annual Total Electrical Energy 
Consumption per capita (in mWh)  
Carbon Footprint  Annual CO2 emissions per capita (in 
tonnes)  
Waste Generation  Annual total waste volume generated by 
the city per capita (in kg)  
Sustainable Urban Planning  Green Space per Capita  Urban green open areas per capita (in m2) 
Mobility  Efficient Transport  Clean Energy Transport  Percentage of Clean -energy Transport use 
(electric train, subway/metro, tram, cable 
railway, electric taxis, bicycling)  
Multi -modal Access  Public Transport Use  % of Public transit trips/ Total trips  
Government  Open Government  Open Data  Open Data Use  
Society  Integration  Internet -connected House -
holds  Percentage of Internet -connected 
households  
Education  University Graduates  Number of University Graduates per 1000 
inhabitants  
Quality of 
Life Safety  Crime  Number of crimes per 100,000 inhabitants  
Health  Life Expectancy  Life Expectancy at birth   City of Kansas City, MO – Smart City Vision Proposal  28 | P a g e  
 12. PAST PERFORMANCE (OR CAPABILITY EVIDENCE ) 
Kansas City and its essential partners  have experience that directly relates to  some capacity of  Smart Cities. 
Listed below are the distinct capabilities from previous performances  that will give Kansas City an advantage 
when developing and deploying their Smart City.  
 
KCMO Existing S mart City I nitiative s 
● Kansas City’s Smart City Initiative  is part of the IEEE Core Smart Cities. The y work  with the local  
IEEE chapter to develop knowledge, share experience with core cities  and support entrepreneurs 
working  with city governance bodies, local i ndustries, local universities, students . 
● Created the Smart City Advisory Board  to advise  management and implementation policies  of smart 
city technology, future smart city integration , and establish  program  evaluation metrics.  
● Kansas City  implemented online resources for citizens to reach city officials, obtain information, and 
do business. Resources include: airport parking facilities, Municipal Court ticketing services, Parks 
& Recreation resources, Water Services payment and service options, Snow Plow GPS tracking, 
and Financial and Business services through QuickTax, KCBizCare , and LandBank.  
● Improved  sustainability by monitoring systems  running solar panels and wind turbines ; strategically 
mapping infrastructure improvements, and regulating electric  usage to conserve energy resources.  
● Kansas City has expanded digital access by offering free Wi -Fi services in libraries, civic buildings, 
and recreation centers. These efforts are  further promoted through engagement with partners such 
as Code for America, KC Digital Drive, Next Century Cities, and the National League of Cities.  
● The Open Data Catalog provides residents City data (e.g., crime stats, traffic counts, 311 information, 
etc.). Open data is also available to be used by civic entrepreneurs – individuals or companies that 
will make a business while also bettering government and how it affects citizens.  
● Created the Open Data Ordinance and hired a c oordinator. Performanc e manag ement functions 
enhance resident engagement, accountability , and transparency of  City operations . They  include 
internal audits, citizen satisfaction surveys, and KCStat reports on council priorities and public -facing 
dashboards. These  functions are open an d available to residents via online tools and social media.  
● The City has a full-time social media manager  to engage with citizens . They also interact with  citizens 
through Nixle, a text notification system, and Nextdoor, a neighborhood social media network.  
KC Scout  
 KC Scout employs sensors over 8,000 highway miles in the Kansas City region and provides updates 
to commuters via digital signage and SMS texts. The system uses cameras, sensors and electronic 
message boards to detect and solve problems a nd incidents on roadways.  
● KC Scout developed a website that features information for citizen. Content includes real -time 
camera views and traffic flows, activated message boards, and information on freeway work zone s. 
KC Streetcar Authority  (KCSA)   
 KCSA is 501(c)(3) organization dedicated to deploying the new streetcar   
 KCSA is initiating a pplication -based data exchanges in the downtown area  to serve as a pilot for 
technology concept expansion and  streetcar  management.  
MoDOT  
● Road to Tomorrow is a transportation laboratory along interstate 70 from Kansas City to St. Louis  for 
testing and developing  new highway technology. They intend to develop a smart highway that 
incorporates truck platooning, data/communication, and renewable energy.  
● MoDOT is working on integrated roadways systems along interstate 70 through a public private 
partnership using smart pavement technologies.   City of Kansas City, MO – Smart City Vision Proposal  29 | P a g e  
 Kansas City Area Transportation Authority  
● KCATA l aunched bus rapid transit line, the Metro Area Express (MAX) on Main Str eet and has 
