city	raw text	clean text	clusterid
KS Kansas City	"Beyond Traffic: The Vision for the 
Kansas City Smart City Challenge  
Part I  – Vision Narrati ve 
   Notice of Funding Opportunity Number DTFH6116RA00002  
 
February 4, 2016   
 
  
 City of Kansas City, MO  
 City of Kansas City, MO – Smart City Vision Proposal  i | P a g e  
 Table of Contents  
1. Smart City Vision  ................................ ................................ ................................ ................................ ... 1 
2. Population Characteristics of Kansas City  ................................ ................................ .............................  6 
3. Kansas City Characteristics  ................................ ................................ ................................ ...................  7 
4. Annotated Preliminary Site Map  ................................ ................................ ................................ ............  9 
5. Smart City Integrated Approach ................................ ................................ ................................ ...........  10 
5.1 Vision Element #1: Urban Automation  ................................ ................................ ...............................  10 
5.2 Vision Element #2: Connected Vehicles  ................................ ................................ ............................  11 
5.3 Vision Element #3: Intelligent, Sensor -Based Infrastructure  ................................ ..............................  11 
5.4 Vision Element #4: Urban Analytics  ................................ ................................ ................................ ... 12 
5.5 Vision Element #5: User -Focused Mobility Services and Choices  ................................ .....................  13 
5.6 Vision Element #6: Urban Delivery and Logistics  ................................ ................................ ..............  14 
5.7 Vision Element #7: Strategic Business Models and Partnering Opportunities  ................................ ... 14 
5.8 Vision Element #8: Smart Grid, Roadway Electrification, and Electric Vehicles  ................................  15 
5.9 Vision Element #9: Connected, Involved Citizens  ................................ ................................ ..............  16 
5.10 Vision Element #10: Architecture and Standards  ................................ ................................ .............  17 
5.11 Vision Element #11: Low -Cost, Efficient, Secure and Resilient Information and Communications 
Technology (ICT)  ................................ ................................ ................................ ................................ ..... 17 
5.12 Vision Element #12: Smart Land Use  ................................ ................................ ..............................  18 
6. Risks Associated with the Deployment Vision  ................................ ................................ .....................  19 
6.1 Key Technical Risks  ................................ ................................ ................................ ....................  19 
6.2 Key Policy/Institutional Risks  ................................ ................................ ................................ ....... 19 
7. Team Partners  ................................ ................................ ................................ ................................ ..... 20 
8. Existing Transportation Infrastructure  ................................ ................................ ................................ .. 22 
9. Data Needs and Availability  ................................ ................................ ................................ .................  23 
9.1 Current Data Collection Efforts and Data Policies  ................................ ................................ .............  23 
9.2 New Data Collection and Integration  ................................ ................................ ................................ . 24 
9.5 Cross -cutting Partnership  ................................ ................................ ................................ ..................  24 
10. ITS and CV Standards/Architecture  ................................ ................................ ................................ . 25 
11. Measurable Goals and Objectives  ................................ ................................ ................................ ... 26 
12. Past Performance (or Capability Evidence)  ................................ ................................ .....................  28 
13. Opportunities to Leverage Federal Resources  ................................ ................................ ................  30  City of Kansas City, MO – Smart City Vision Proposal  1 | P a g e  
 1. SMART CITY VISION  
Smart Cities are at the  forefront of the nation’s mind  right now, and we have seen an enormous surge in the 
discussions about the possibilities and benefits of Smart Cities. While there are many similar definitions of 
the concept in circulation, one that summarizes many of the elements required to make a city  or region 
connected and “smart” is:  
“A city that uses information and communications technology to enhance its livability, 
workability, and sustainability.”  —The Smart Cities Council  
 
Kansas City, Missouri has truly reinvented itself over the past deca de, and now boasts a thriving technical / 
innovation economic sector, vibrant culinary and performing arts scenes, the historic 18th and Vine district, 
our renowned parks and boulevard system and, of course, the World Champion Kansas City Royals. These 
attributes are not all that define Kansas City. In recent years, we have experienced city -wide revitalization 
due to significant infrastructure improvements including a downtown streetcar, one of the bi ggest  smart city 
investments in  America, and the growth of start-up businesses and commercial businesses as a result. 
Flyover city no more, Kansas City is the cent er of the American renaissance.  We are the model city to look 
to for ideas on how to fight crime, get kids reading on grade level, s upport small entrepreneurs, narrow the 
digital divide, innovate government processes , and grow the economy in all the right ways.   
 
Cities are at the forefront of change, influencing 
and touching citizens’ daily lives in a myriad of 
ways.  Transportation is at the heart of it all, driving 
citizen access to other  quality of life amenities. As 
technology evolves, so too must cities and the 
transportation infrastructure that weaves a city 
together. Kansas City, with a population of 
459,787, is an ideally sized city to implement next -
generation technology in mature a nd evolving 
neighborhoods.  A smart city is not defined 
exclusively by technology; rather, it is defined by 
the way a city eases the lives of its citizens and 
provides essential services in the most efficient 
manner possible. From a city perspective, 
trans portation is among the most essential 
services. Cars are not merely machines, but the 
means by which a family goes from their home to their schools, to their places of employment, to their doctors’ 
offices, to visit their parents, and then back home again.  In an urban core surrounded by rural communities, 
the synchronized interaction of busses, streetcars, bicycles, walking paths and freight operations enable 
citizens to live their lives. In this vein, cities must make transportation safer, easily accessibl e, more efficient, 
and user friendly by using advanced technologies that protect our environment.  
 
Kansas City, MO is doing just that.  Building upon our existing smart city infrastructure and open data systems, 
expansive highway and roadway system, existi ng placemaking and digital inclusion efforts, our vision focuses 
on using technology and establishing metrics that will directly impact neighborhoods. We will begin in those 
that need impactful infrastructure improvements the most. Neighborhoods east of Tr oost, a street that has 
historically divided socioeconomic classes in our city (i.e. the “East Side”), especially need these investments. 
The existing Smart + Connected City initiative is 
being driven by a partnership with Cisco, Sprint, 
and others to enhance internet availability, 
energy savings, new revenue streams, and 
improve connectivity with citizens, including 
efforts to bridge the “digital divide.” The initiative 
will attract technology startups from across the 
globe to test their conc epts here as KCMO 
becomes an open data “Living Lab.” The changes 
are happening first along the 2.2 -mile downtown 
streetcar line and will change the way the city 
works – from more efficient management of 
infrastructure like traffic signals, streetlights, an d 
storm water systems to new ways to engage with 
residents and visitors.  
  City of Kansas City, MO – Smart City Vision Proposal  2 | P a g e  
 Unemployment, poverty, and crime rates are disproportionately higher in this area. The Beyond Traffic grant 
would prov ide a means for these neighborhoods to access WiFi and the Internet, develop better cost/time 
efficient transportation, and increase economic development.  As a result, Kansas Citians will get to their jobs 
faster, easier and more cheaply. Residents will h ave greater access to educational, employment, dietary and 
health care opportunities, and citizens will live in safer, cleaner and better connected communities.  
 
Kansas City is implementing cutting edge smart cities technologies and preparing for what’s ne xt. 
Autonomous vehicles, currently designated as the “car of tomorrow,” will be better positioned in a city that is 
preparing for it today. Three important factors directly support these efforts:  
(1) Kansas City has 319 square miles within its boundaries and almost 8,000 square miles in the 
metropolitan area; we maintain the most highway miles in the region and manage the interstate system from 
the Colorado/Kansas border to the  outskirts of Saint Louis   
(2) Kansas City has the most established infrastructu re of fiber and WiFi in the United States; we 
were the first Google Fiber city and were recently lauded by HUD Secretary Castro  
(3) Kansas City hosts two major car manufacturing facilities; we are a conveniently located test bed 
for automobile industry R& D activities.  
 
Finally, it is important that we continue to make our current transportation as connected and robust as 
possible. We propose several initiatives that enhance our recent investments, including better use of bike 
sharing through road diets, an d an app for Kansas City residents and visitors to provide clear and simple 
wayfinding. Our approach combines new technology (i.e. connected / autonomous vehicles, and smart city 
sensors) with existing transportation infrastructure, and it results in a sys tem that generates a positive impact 
much greater than the sum of its parts.  
 
Kansas City will meet the Smart City Challenge with three interconnected efforts, which we refer to as our 
“pillars.” These pillars will enable us to develop, validate, and depl oy elements of a 22nd Century 
transportation system that can evolve as technologies continue to develop. The three pillars include:  
1)  Deploying East Side Transportation and Connectivity Solutions  
2)  Increasing Key Corridor Safety t hrough Connected and Autonomous Vehi cles  
3)  Increa sed Mobility and Accessibility t hrough Information Sharing  
The three pillars will result in improved quality of life in East Side neighborhoods, decreased congestion in 
key transportation corridors, increased safety throughout the transportation system, provide transportation 
system and connectivity access to all sectors of the city’s population, reduced negative environmental 
impacts, integrated city -wide infrastructure and systems, and move the development and economic vitality 
of the region into its next phase of evolution. Each pillar in our concept is described below, all three of 
which will be integrated to provide city -wide improvement of transportation systems in a Smart City 
environment. These efforts will complement those a lready underway in the Kansas City Smart + Connected 
City initiative.  
 
Kansas City’s extensive open data capability, resident in the City’s Office of Performance Management, is a 
first-of-its-kind data collection and analysis approach. New data from the cur rent Smart + Connected City 
initiative is collected through Sensity and Cisco platforms beginning in March/April 2016 and will add to a 
robust, existing open data system. The city serves as the major regional economic engine, affecting both the 
states of K ansas and Missouri.  The Kansas City area represents 38% of the gross domestic  product of the state 
of Missouri’s eight metropolitan areas, and the city’s metropolitan area generates Kansas’ largest GDP. 
Multiple state jurisdictions in the region require co mplex maintenance planning and synchronization efforts, 
but can also take advantage of more available funding and a greater spectrum of ideas to solve challenges.   City of Kansas City, MO – Smart City Vision Proposal  3 | P a g e  
  
Our three pillars include attention to key areas of the city that address the USDOT’s vision  elements and the 
building blocks for continued development of a comprehensive Smart City solution. The deployments 
described in our pillars will result in both short - and longer -term positive impacts. As the city becomes more 
accessible and connected, we will be positioned and able to integrate additional data and analyses, 
communications systems, and overall more intelligent solutions with other critical infrastructure and city -wide 
systems, including the energy and utility sectors, health options and sol utions, and even education.  
 
Figure  1-1: Kansas City Smart City Vision  
 
 
Pillar 1: East Side Transportation and Connectivity S olutions  
Neighborhoods on the  east side of Kansas City are in need of digitization  in order to help advance the 
economic and social environment for  underserved segments of the population , and to address p ublic safety 
concerns inhibiting growth and opportunity . This first pillar  of our Smart City concept focuses on transforming 
the easte rn third of the city along Prospect Ave . The population  in this area  is highly dependent on public 
transportation and cellular phone -based digital connectivity.  Average incomes are below regional average s 
and unemployment rates are high . Crime rates are hi gher in this area and economic development efforts 
continue to serve a population of citizens with a high rate of poverty.  
 
Our East Side Transportation and Connectivity Solutions  will focus development along an existing eight -mile 
bus line and bus rapid transit line that is slated to begin operations in 2018 by the City and Kansas City Area 
Transportation Authority (KCATA).  This line runs on Prospect Ave  bounded on the north by the Jazz District 
at 18th and Vine and on the south by the Marlborough Neighbo rhood and AlphaPointe, a comprehensive 
rehabilitation and education agency for people with vision loss providing outreach, services, employment and 
education  and is  the third largest single employer of visually impa ired individuals in the U nited States . Our 
concept in this area will  increase safety, mobility services, accessibility to the visually impaired, and 
 City of Kansas City, MO – Smart City Vision Proposal  4 | P a g e  
 employment resources and opportunities along the Prospect Ave corridor  via WiFi, connectivity, and 
additional transportation options . These effort s will result in an Initial Digital Infrastructure, or “Information 
Superhighway” that will enable citizens to meet and lead the rest of the city in terms of access and 
involvement in ne w economic models and activity. In addition, t he digital access and su pporting education 
and training programs that will accompany the digital expansion and improvement of the transportation 
system will catapult the area , and by extension the city, to be a forward -looking community rooted in new 
technology skills and access.  Specifically, the efforts in this pillar will:  
 
Increase safety  by integrating new technologies  such as  new gunshot detection technologies connected 
directly to active  patrol cars close to a suspected location, whi le notifying HQ. The results of the detection 
technology will be reviewed and analyzed in real time and integrated into the City Infrastructure Management 
(CIM)  Platform.  We will expand the current deployment of Sensity smart lighting and video sensor technology  
in the downtown area to this corridor , enabl ing a multitude of other solutions  and insights  that will increase 
safety . We will also consider the  deploy ment of  smart pavement that has sensors and embedded lights that 
further illuminate the environment.  Deployment of Connected Vehicle (CV) applications such as Vehicle 
Turning Right in Front of Transit Vehicle and Pedestrian in Signalized Crosswalk will also improve the safety 
of transit riders, cyclists , and pedestrians.  
 
Increase mobility services  by implementing dynamic ridesharing op portunities, additional bike share 
stations, vehicle share stations, and digital sensors on both bus stop shelters and buses. Data collected from 
these sensors will help support efficient movement of traffic, identify requirements for dynamic tasking of 
buses or other public transportation assets, and improve responsiveness of public safety resources. Kansas 
City will also utilize CV applications such as Transit Signal Priority to improve bus route efficiency. Interactive 
transit stations will provide real -time trip planning and arrival displays with information on multi -modal 
connections throughout the corridor .  
 
Increase accessibility to the visually impaired  by implementing CV applications such as Route ID for the 
Visually Impaired to assist them with th e identification of  the appropriate bus and route to their intended 
destination, transit stop navigation and audible signage, safe pedestrian crossings, and Remote Infrared 
Audible Signage (RIAS) technology consisting of infrared transmitters repeatedly se nding encoded spoken 
versions of the contents of signage through wireless communication.  
 
Increase employment resources and opportunities  by including public WiFi along the entire transit 
corridor as well as on the entire KCATA bus fleet (April 2016) to pr ovide an interactive service for citizens 
within the corridor and wayfinding applications that support citizens’ information requirements in real time 
including job search, education, transportation options , and support functions.  
 
Pillar 2: Increasing Key Corridor Safety through Connected and Autonomous Vehicles  
The second pillar to our Smart City concept is focused on deploying both connected vehicle (CV) and 
automated vehicle (AV) technologies  within multiple areas of the city, including on a corridor from the airport 
to downtown , and along the I -70 highway . In addition to many of the positive safety, mobility , and 
environmental impacts that are often at the center of CV and AV deployments, our vision also focuses on the 
interaction between people  using automobiles as their primar y transportation resource and the community.  
 
The goal of this pillar of the Smart City Challenge  is to improve passenger safety, increase efficiency across 
the highway networks, and validate the optimal experience for the operator of a smart and connecte d vehicle. 
Applications that can be tested in this effort include traffic direction or management systems, accident  City of Kansas City, MO – Smart City Vision Proposal  5 | P a g e  
 mitigation prioritization, and direct advertising that addresses an individual’s needs  along with additional 
applications  that will naturall y develop through Kansas City’s Living Lab . Kansas City also plans to  expand 
the planned one -mile “road to tomorrow” pilot into connective tissue that links thousands of commuters 
throughout the region and validates a realistic scenario that can be replica ted by other cities.  
 
Existing regional infrastructure and development efforts,  including midtown sensors managed by the city, 
regional sensors distributed over an 8,000 mile regional network managed by KC Scout  (joint TMC operated 
by the Missouri and Kan sas Department s of Transportation ), data from the region’s transit fleets, and ongoing 
efforts to construct a “smart highway” on I -70 within the city limits, provide the elements upon which to build 
to create an living  laboratory to address  the multiple ch allenges that commuters face daily.  
 
Beginnin g in regulated spaces like the a irport property or in bus lanes, Kansas City citizens are ready to ride 
in autonomous vehicles today. The grant will provide us with additional opportunities to expand and deploy  
the technologies in these areas. CVs and AVs  will keep passengers connected to directional or site -specific 
information, inform passengers about traffic issues or local events, and keep passengers safe. Kansas City 
will build on  the findings from initial CV and AV studies  by incrementally integrating these vehicles into traffic. 
Close collaboration between automobile manufacturers , analytics firms based in Kansas City , and 
universities will pave the way for future implementation in similarly sized and larg er cities.  
 
Our deployment of new technologies along the I -70 corridor will also address some of our freight challenges. 
Current efforts to address freight challenges include:  
 Smart technologies in use by the major railroad 
corporations operating under the umbrella of the 
Kansas City Terminal Railway   
 Establishment of a SmartPort, integrating multi -
modal operations and is beginning to add barge 
operations on the Missouri River  
Building off our current efforts, we will develop 
additional analyses to understand where t he need for new technologies exist , as well as  targeted plans and 
processes that will integrate new technologies and data management techniques in order  to further improve 
efficiencies in freight management operations . These efforts will also have a downst ream impact on the 
economic well -being of the region, reduce  pollution associated with the transportation industry and large 
numbers of freight movers, and improve worker safety for all the firms involved in these operations.  
 
Pillar 3:  Information Sharing  and Increased Mobility/Accessibility  
Our third pillar of the  concept is to increase the connectivity and information sharing by advanc ing the steps 
already made for new transportation options and technologies with the 2.2 mile streetcar starter line , slat ed 
to begin operation in April 2016 . While there is already construction underway  to build the streetcar, we will 
build upon this momentum to add connectivity, integrate the streetcar with other modes in terms of 
accessibility and scheduling, thus connecti ng new areas, increasing public transport options, and bringing in 
new technologies and connectivity to citizens throughout the city. Our current efforts to expand public WiFi, 
put in place digital information kiosks , increase speedy movement throughout  the downtown  along the new 
Kansas City Freight Landscape  
The largest rail freight traffic (by tonnage) 
hub in the United States  
The third largest trucking hub in the country  
Houses four multi -modal logistics hubs 
providing the full range of transportation 
services   City of Kansas City, MO – Smart City Vision Proposal  6 | P a g e  
 streetcar line, and deploy related  applications will be increased and expanded to include more connectivity 
and integration to multiple city systems.  
  
The current Smart + Connected City effort includes select 
smart streetlights with video sensors to detect blockages  on 
the street car line and improve safety, as well as t wenty -five 
kiosks that provide citizens the opportunity to learn about 
nearby activities, interact with the city through messaging 
formats , or obtain knowledge about city services if they 
have no smart phone. For th e Smart City Challenge, we will 
integrate the findings from the data receive d through the 
sensors and videos, as well as kiosks, with the other 
information from data across the city’s improved 
transportation systems.   
 
As Kansas City  moves  into the world of “Big Data”  we will 
continue to make data open and available to the public 
and entrepreneurs to develop innovative applications that benefit the local government and citizens. The 
city will  develop additional capabilities beyond the Smart Ci ty grant  based on data collected by sensors. 
Possibilities range from dynamic tasking of  public transportation assets based on population movement, to 
focused application of public safety resources based on sensor data , to decreasing  congestion due to 
interconnected traffic lights , and increasing  availability of non -vehicle tr affic.  
2. POPULATION CHARACTERISTICS OF KANSAS CITY 
Kansas City, MO meets the population characteristics set for the ideal Smart City.  
● KCMO is a mid -sized city with a Census -Designated Place (CDP) population of  459,787  in the 
2010 Census data  
● KCMO has a population density of 1,460 people per square mile  
● KCMO CDP population represents 29.75% of the Census Urbanized Area (UZA) populatio n 
 
Table 2-1: Age, 2010 Census  
Age Group  Population  Percentage of Total  Percentage of Total  
Under 18  111,058  24.2 34.2 18 – 24  45,913  10 
25 – 34  75,490  16.4 36.7 35 – 49  93,523  20.3 
